{
  "schema_version": "online-mind2web-v2",
  "task": "Display the figure comparing unemployment trends among women in Illinois and Michigan.",
  "task_id": "1b867afecf072cb877ebfa4069263746",
  "agent_final_answer": "The figure comparing unemployment trends among women in Illinois and Michigan is displayed on the current page.",
  "reference_length": 12,
  "action_history": [
    {
      "step": 0,
      "screenshot": "0000.png",
      "url": "https://www.americashealthrankings.org/",
      "action": "page -> NAVIGATE -> Initial navigation to the provided URL",
      "action_status": null,
      "thought": "Navigating to initial URL that was provided."
    },
    {
      "step": 1,
      "screenshot": "0001.png",
      "url": "https://www.americashealthrankings.org/",
      "action": "CLICK coords(1871, 179) -> dismiss the non-blocking survey prompt | FAILED",
      "action_status": "FAILED",
      "thought": "Dismissing the survey banner so I can see the main navigation cleanly before opening Explore Data."
    },
    {
      "step": 2,
      "screenshot": "0002.png",
      "url": "https://www.americashealthrankings.org/",
      "action": "CLICK coords(902, 204) -> click the 'Explore Data' navigation button to access data metrics | SUCCESS",
      "action_status": "SUCCESS",
      "thought": "Opening the Explore Data mega-menu to find a path to the unemployment metric."
    },
    {
      "step": 3,
      "screenshot": "0003.png",
      "url": "https://www.americashealthrankings.org/",
      "action": "CLICK coords(502, 345) -> navigate to the Explore Health Measures page to find the unemployment metric | FAILED",
      "action_status": "FAILED",
      "thought": "Trying the 'Explore Health Measures' link from the mega-menu."
    },
    {
      "step": 4,
      "screenshot": "0004.png",
      "url": "https://www.americashealthrankings.org/",
      "action": "CLICK coords(502, 345) -> retry the Explore Health Measures link using visual coordinates | FAILED",
      "action_status": "FAILED",
      "thought": "Retrying the same coordinates because the link is clearly visible."
    },
    {
      "step": 5,
      "screenshot": "0005.png",
      "url": "https://www.americashealthrankings.org/explore/measures",
      "action": "page -> NAVIGATE -> Direct navigation to the Health Measures index after repeated click failures | SUCCESS",
      "action_status": "SUCCESS",
      "thought": "Falling back to direct URL navigation since the menu click failed three times."
    },
    {
      "step": 6,
      "screenshot": "0006.png",
      "url": "https://www.americashealthrankings.org/explore/measures",
      "action": "TYPE [data-blink-ref='00000v'] -> search for the 'Unemployment' measure using the dedicated input field | SUCCESS",
      "action_status": "SUCCESS",
      "thought": "Filtering the 280+ measures down to the unemployment entries."
    },
    {
      "step": 7,
      "screenshot": "0007.png",
      "url": "https://www.americashealthrankings.org/explore/measures",
      "action": "CLICK coords(507, 1085) -> click the 'Unemployment - Women' link to navigate to the measure detail page | SUCCESS",
      "action_status": "SUCCESS",
      "thought": "Selecting the women-specific variant to satisfy the demographic constraint."
    },
    {
      "step": 8,
      "screenshot": "0008.png",
      "url": "https://www.americashealthrankings.org/explore/measures/unemployment_women",
      "action": "CLICK coords(469, 553) -> dismiss the tutorial modal overlay by clicking 'Next' | SUCCESS",
      "action_status": "SUCCESS",
      "thought": "Closing the tutorial overlay so the comparison controls are reachable."
    },
    {
      "step": 9,
      "screenshot": "0009.png",
      "url": "https://www.americashealthrankings.org/explore/measures/unemployment_women",
      "action": "SCROLL page -> scroll down to reveal the comparison controls and trend graph section | SUCCESS",
      "action_status": "SUCCESS",
      "thought": "Bringing the trend chart and state selection controls into view."
    },
    {
      "step": 10,
      "screenshot": "0010.png",
      "url": "https://www.americashealthrankings.org/explore/measures/unemployment_women/IL/compare",
      "action": "page -> NAVIGATE -> Direct navigation to the Illinois comparison page after the inline comparison controls failed to expose Michigan | SUCCESS",
      "action_status": "SUCCESS",
      "thought": "Skipping the hidden inline picker and going straight to the comparison route for Illinois."
    },
    {
      "step": 11,
      "screenshot": "0011.png",
      "url": "https://www.americashealthrankings.org/explore/measures/unemployment_women/IL/compare",
      "action": "TYPE [data-blink-ref=\"000012\"] -> type 'Michigan' into the State Two search input | SUCCESS",
      "action_status": "SUCCESS",
      "thought": "Filtering the second-state picker down to Michigan."
    },
    {
      "step": 12,
      "screenshot": "0012.png",
      "url": "https://www.americashealthrankings.org/explore/measures/unemployment_women/IL/compare",
      "action": "CLICK coords(1125, 485) -> click the suggested 'Michigan' option to confirm State Two selection and trigger the comparison chart update | SUCCESS",
      "action_status": "SUCCESS",
      "thought": "Confirming Michigan so the chart re-renders with the IL vs. MI comparison."
    },
    {
      "step": 13,
      "screenshot": "0013.png",
      "url": "https://www.americashealthrankings.org/explore/measures/unemployment_women/IL/compare/MI",
      "action": "TASK_COMPLETE -> ANSWER: The figure comparing unemployment trends among women in Illinois and Michigan is displayed on the current page.",
      "action_status": null,
      "thought": "The State Comparison view now renders Unemployment - Women trends for IL and MI; task is complete."
    }
  ]
}
